{
  "$schema": "https://json-schema.org/draft/2020-12/schema",
  "title": "FAMtastic Data Center Research Job",
  "type": "object",
  "required": [
    "id",
    "title",
    "created_at",
    "status"
  ],
  "properties": {
    "id": {
      "type": "string"
    },
    "title": {
      "type": "string"
    },
    "source": {
      "type": "string"
    },
    "status": {
      "type": "string"
    },
    "budget": {
      "type": "object"
    },
    "created_at": {
      "type": "string"
    },
    "updated_at": {
      "type": "string"
    }
  }
}
