{
  "id": "research-20260519225124-perplexity-metadata-preservation-proof",
  "title": "Perplexity metadata preservation proof",
  "source": "perplexity",
  "status": "created",
  "budget": {
    "maxUsd": 0.01
  },
  "created_at": "2026-05-19T22:51:24.264Z",
  "updated_at": "2026-05-19T22:51:24.264Z"
}
