{
  "id": "research-20260521193153-phase2a-ai-logo-production-readiness",
  "title": "phase2a-ai-logo-production-readiness",
  "source": "perplexity",
  "status": "created",
  "budget": {
    "maxUsd": 0.01
  },
  "created_at": "2026-05-21T19:31:53.761Z",
  "updated_at": "2026-05-21T19:31:53.761Z"
}
