{
  "id": "research-20260521171734-media-studio-logo-brand-ai-workflow-research",
  "title": "Media Studio logo brand AI workflow research",
  "source": "perplexity",
  "status": "created",
  "budget": {
    "maxUsd": 0.01
  },
  "created_at": "2026-05-21T17:17:34.802Z",
  "updated_at": "2026-05-21T17:17:34.802Z"
}
