{
  "id": "research-20260521193145-phase2a-brand-kit-production-workflow",
  "title": "phase2a-brand-kit-production-workflow",
  "source": "perplexity",
  "status": "created",
  "budget": {
    "maxUsd": 0.01
  },
  "created_at": "2026-05-21T19:31:45.215Z",
  "updated_at": "2026-05-21T19:31:45.215Z"
}
