{
  "id": "research-20260521171744-ai-website-builder-edit-enhancement-workflow-research",
  "title": "AI website builder edit enhancement workflow research",
  "source": "perplexity",
  "status": "created",
  "budget": {
    "maxUsd": 0.01
  },
  "created_at": "2026-05-21T17:17:44.558Z",
  "updated_at": "2026-05-21T17:17:44.558Z"
}
